tables/table_05_optimal_conditions.csv

Objective,Glucose [mM],Glutamine [mM],VCD [cells/mL],Harvest Time [d],Cell Culture Cost [$/L],Cell Culture Value Median [$/L],Cell Culture Value Lower 95% [$/L],Cell Culture Value Upper 95% [$/L],Space-Time Profit Median [$/L/d],Space-Time Profit Lower 95% [$/L/d],Space-Time Profit Upper 95% [$/L/d],Space-Time Yield Median [mg/L/d],Space-Time Yield Lower 95% [mg/L/d],Space-Time Yield Upper 95% [mg/L/d]
profit,20.0,1.0,200000.0,2.6666666666666665,320.0,605.1694501837226,444.913146180798,775.1793889255417,77.77348641374255,34.06722168567217,124.13983334332958,0.16504621368646982,0.12133994895839946,0.21141256061605684
yield,25.0,4.0,1200000.0,1.3333333333333333,930.0,504.8485859224478,359.34175835087837,651.7700940410402,-182.20774889037955,-244.5678178496236,-119.24138826812565,0.21636367968104908,0.15400361072180502,0.27933004030330294

README.md

### Optimizations and Input Feature Impacts

As seen, optimal conditions vary based on the maximized variable. We can see that the maximum space-time profit has relatively low concentrations for glucose, glutamine, and VCD, initially. On the other hand, the maximum space-time yield has higher initial concentrations.
Based on these results, we can see that our profit and yield optima differ; specifically, we can see that the 95% yield interval for the space-time profit is negative. We can conclude that by maximizing production efficiency, we are not necessarily maximizing the economics of the process.
To maximize the space-time profit, the following initial conditions are recommended: a glucose concentration of 20 mM, a glutamine concentration of 1 mM, and a VCD of 200,000 cells/mL. Harvest time is recommended to be 2.67 days. Here, cell cost is $320/L, median cell culture value at harvest is $605.17/L ; the 95% prediction interval is $444.91-775.18/L. The median space-time profit is then $77.77/(L*d), with its 95% prediction interval being $34.07-124.14/(L*d). The estimated median mAb space-time yield is 0.1650 mg/(L·d), with its 95% prediction interval being 0.1213-0.2114 mg/(L·d).